{
  "id": "create_project",
  "name": "Crear proyecto React",
  "domain": "desarrollo",
  "type": "composed",
  "description": "Crea un proyecto React usando Vite",
  "inputs": {
    "project_name": {"type": "string", "required": true, "description": "Nombre del proyecto"},
    "target_dir": {"type": "string", "required": false}
  },
  "outputs": {
    "project_path": {"type": "string"},
    "status": {"type": "string", "enum": ["success", "error"]}
  },
  "requirements": {
    "tools": ["execution_run_command", "filesystem_list_directory"],
    "capabilities": ["execute_command", "list_directory"],
    "integrations": []
  },
  "strategy": {
    "mode": "sequential",
    "steps": [
      {
        "step_id": "create_project",
        "action": "execution_run_command",
        "params": {
          "command": "npm create vite@latest {{inputs.project_name}}",
          "cwd": "{{inputs.target_dir}}"
        }
      },
      {
        "step_id": "install_dependencies",
        "action": "execution_run_command",
        "params": {
          "command": "npm install",
          "cwd": "{{steps.create_project.outputs.project_path}}"
        }
      }
    ]
  },
  "exposure": {
    "visible_to_user": true,
    "trigger_phrases": ["crear proyecto react", "nuevo proyecto react"]
  },
  "lifecycle": {
    "version": "1.1.0",
    "status": "ready"
  }
}
